{
  "telemetry_version": 1,
  "event_id": "20260920T164746Z-f3d7ea",
  "event_type": "human_gate",
  "recorded_at": "2026-09-20T16:47:46.123203Z",
  "task_id": "AUTONOMY-001",
  "run_id": null,
  "actor": "human",
  "decision_source": "human",
  "environment": {
    "models_sha256": "06646ed183433b8e6cebc68a257f55d02aeb6b41e8cd3b53ad8717544027fda4",
    "agentflow_sha256": "27490fdc86a929db8a6b220f6191d08ef15da7ef27339f6f9bae10bdef495051"
  },
  "supersedes_event_id": null,
  "artifact_refs": [],
  "decision": "accepted_as_is",
  "decided_at": null,
  "note": "Human accepted AUTONOMY-001 as-is after final closure review PASS: 0 BLOCKER, 0 HIGH, 0 MEDIUM, 1 acceptable deferred LOW; 86/86 AUTONOMY tests, 524/524 full suite, critical mutations killed, stress recheck 480 executions with 0 spurious INTERNAL_ERROR and 0 unrelated signals, review integrity CLEAN."
}
