{
  "telemetry_version": 1,
  "event_id": "20260918T184042Z-0a9b82",
  "event_type": "human_gate",
  "recorded_at": "2026-09-18T18:40:42.760977Z",
  "task_id": "TEL-001-R1",
  "run_id": null,
  "actor": "human-operator",
  "decision_source": "human",
  "environment": {
    "models_sha256": "83f21086a7090e538192e323853d2db8a9e04d6f3f44bda5b287dcab41ca3d63",
    "agentflow_sha256": "06e1f9791088eaac618e786cdb4828a38eab8608aabcd47a90553a61c393860d"
  },
  "supersedes_event_id": null,
  "artifact_refs": [],
  "decision": "accepted_as_is",
  "decided_at": null,
  "note": "Accepted after Muse implementation and independent fresh DeepSeek V4.1 Flash review: 0 BLOCKER, 0 HIGH, 0 MEDIUM."
}
