{
  "telemetry_version": 1,
  "event_id": "20260917T124733Z-de116a",
  "event_type": "human_gate",
  "recorded_at": "2026-09-17T12:47:33.331563Z",
  "task_id": "TEL-001",
  "run_id": null,
  "actor": "human-operator",
  "decision_source": "human",
  "environment": {
    "models_sha256": "83f21086a7090e538192e323853d2db8a9e04d6f3f44bda5b287dcab41ca3d63",
    "agentflow_sha256": "06e1f9791088eaac618e786cdb4828a38eab8608aabcd47a90553a61c393860d"
  },
  "supersedes_event_id": null,
  "artifact_refs": [],
  "decision": "accepted_as_is",
  "decided_at": null,
  "note": "TEL-001 accepted after Muse implementation and independent DeepSeek review PASS."
}
